{
  "$schema": "https://hookforge.pages.dev/schema/hook-manifest.json",
  "slug": "liquidity-floor",
  "name": "LiquidityFloor",
  "contract": "LiquidityFloorHook",
  "version": "1.0.0",
  "family": "Liquidity provider economics",
  "summary": "A liquidity commitment enforced per position: a fraction of what you add cannot leave until the pool's unlock date, and every provider is held to that fraction of their own stake rather than to a shared pool total.",
  "description": "A new pool has a bootstrapping problem that is really a credibility problem. Swappers cannot tell the difference between liquidity that intends to stay and liquidity that will leave the moment the pool is quoted by an aggregator, and the second kind is indistinguishable from the first right up until it is gone. The published answers lock whole positions for a term. That works and it is also badly mispriced: a provider who would happily commit a third of their capital for six months has to choose between committing all of it and committing none. Term locks therefore select for the providers least sensitive to the lock, which is not the same set as the providers most useful to the pool. This hook takes the commitment as a *fraction*. Configure `floorBps` and `unlockTimestamp`, and thereafter each position may freely withdraw down to `floorBps` of everything it has ever added, with the remainder released at the unlock. Adding more liquidity raises your own floor proportionally, so topping up is never a trap: you keep the same ratio of free to committed capital that you signed up for. The design is deliberately race-free, which is the property that distinguishes it from a pool-wide minimum. A floor expressed as \"total pool liquidity must stay above X\" is a bank run waiting to happen: it is satisfiable by whoever withdraws first and binding only on whoever is last, so rational providers race for the exit precisely when the pool most needs them. Holding each position to its own commitment removes the race entirely. Nothing another provider does can change what you are allowed to withdraw. The hook takes no fee, holds no funds and has no privileged role. It cannot stop a provider from ceasing to quote, only from removing committed liquidity, and it does not restrict swaps at all. Position identity is the v4 position key: the address that called `modifyLiquidity` on the `PoolManager` (in practice a position manager or a router), the tick range, and the caller's salt. Two providers sharing one position manager therefore share a commitment only if they also share a salt, which position managers do not do. Prior art: `LiquidityLock`, `Timelock Addition` and `LockingLiquidity` all lock positions wholesale for a term. Fractional, per-position, top-up-safe commitments are the contribution here.",
  "priorArt": "LiquidityLock, Timelock Addition and LockingLiquidity all lock positions wholesale for a term. Fractional, per-position, top-up-safe commitments are the contribution here, along with the observation that a pool-wide minimum is a bank run rather than a floor.",
  "limitation": "The commitment binds the v4 position key, which is the address that called modifyLiquidity. A provider who routes through a position manager that pools many users under one key would share a commitment with them; every mainstream position manager gives each position its own key, but a custom router need not.",
  "tags": [
    "lp-economics",
    "commitment",
    "launch",
    "rug-resistance"
  ],
  "recommendedChains": [
    "base",
    "arbitrum",
    "unichain",
    "robinhood",
    "ethereum",
    "optimism",
    "polygon",
    "bnb"
  ],
  "source": "contracts/src/hooks/LiquidityFloorHook.sol",
  "docs": "https://hookforge.pages.dev/hooks/liquidity-floor",
  "permissions": {
    "afterRemoveLiquidityReturnsDelta": false,
    "afterAddLiquidityReturnsDelta": false,
    "afterSwapReturnsDelta": false,
    "beforeSwapReturnsDelta": false,
    "afterDonate": false,
    "beforeDonate": false,
    "afterSwap": false,
    "beforeSwap": false,
    "afterRemoveLiquidity": false,
    "beforeRemoveLiquidity": true,
    "afterAddLiquidity": true,
    "beforeAddLiquidity": false,
    "afterInitialize": true,
    "beforeInitialize": false
  },
  "permissionsSource": "declaration",
  "properties": {
    "dynamicFee": false,
    "upgradeable": false,
    "requiresCustomSwapData": false,
    "vanillaSwap": true,
    "swapAccess": "none"
  },
  "configure": {
    "signature": "configure((address,address,uint24,int24,address),(uint16,uint64))",
    "fields": [
      {
        "name": "floorBps",
        "type": "uint16"
      },
      {
        "name": "unlockTimestamp",
        "type": "uint64"
      }
    ]
  },
  "errors": [
    {
      "signature": "CommitmentBreached(uint256,uint256)",
      "notice": "The withdrawal would take the position below its commitment."
    },
    {
      "signature": "HookNotImplemented()",
      "notice": "The hook function is not implemented."
    },
    {
      "signature": "InvalidFloor()",
      "notice": "`floorBps` was zero (no commitment) or above 100%."
    },
    {
      "signature": "InvalidPool()",
      "notice": "The pool is not configured to use this hook."
    },
    {
      "signature": "PoolAlreadyInitialized()",
      "notice": "The pool already exists, so its configuration is final."
    },
    {
      "signature": "PoolNotConfigured()",
      "notice": "The pool was initialized without a configuration for this hook."
    },
    {
      "signature": "UnlockInThePast()",
      "notice": "The unlock must be in the future at configuration time, or the commitment means nothing."
    }
  ],
  "deployments": [],
  "abi": [
    {
      "type": "constructor",
      "inputs": [
        {
          "name": "_poolManager",
          "type": "address",
          "internalType": "contract IPoolManager"
        }
      ],
      "stateMutability": "nonpayable"
    },
    {
      "type": "function",
      "name": "addedLiquidity",
      "inputs": [
        {
          "name": "",
          "type": "bytes32",
          "internalType": "PoolId"
        },
        {
          "name": "",
          "type": "bytes32",
          "internalType": "bytes32"
        }
      ],
      "outputs": [
        {
          "name": "",
          "type": "uint256",
          "internalType": "uint256"
        }
      ],
      "stateMutability": "view"
    },
    {
      "type": "function",
      "name": "afterAddLiquidity",
      "inputs": [
        {
          "name": "sender",
          "type": "address",
          "internalType": "address"
        },
        {
          "name": "key",
          "type": "tuple",
          "internalType": "struct PoolKey",
          "components": [
            {
              "name": "currency0",
              "type": "address",
              "internalType": "Currency"
            },
            {
              "name": "currency1",
              "type": "address",
              "internalType": "Currency"
            },
            {
              "name": "fee",
              "type": "uint24",
              "internalType": "uint24"
            },
            {
              "name": "tickSpacing",
              "type": "int24",
              "internalType": "int24"
            },
            {
              "name": "hooks",
              "type": "address",
              "internalType": "contract IHooks"
            }
          ]
        },
        {
          "name": "params",
          "type": "tuple",
          "internalType": "struct ModifyLiquidityParams",
          "components": [
            {
              "name": "tickLower",
              "type": "int24",
              "internalType": "int24"
            },
            {
              "name": "tickUpper",
              "type": "int24",
              "internalType": "int24"
            },
            {
              "name": "liquidityDelta",
              "type": "int256",
              "internalType": "int256"
            },
            {
              "name": "salt",
              "type": "bytes32",
              "internalType": "bytes32"
            }
          ]
        },
        {
          "name": "delta0",
          "type": "int256",
          "internalType": "BalanceDelta"
        },
        {
          "name": "delta1",
          "type": "int256",
          "internalType": "BalanceDelta"
        },
        {
          "name": "hookData",
          "type": "bytes",
          "internalType": "bytes"
        }
      ],
      "outputs": [
        {
          "name": "",
          "type": "bytes4",
          "internalType": "bytes4"
        },
        {
          "name": "",
          "type": "int256",
          "internalType": "BalanceDelta"
        }
      ],
      "stateMutability": "nonpayable"
    },
    {
      "type": "function",
      "name": "afterDonate",
      "inputs": [
        {
          "name": "sender",
          "type": "address",
          "internalType": "address"
        },
        {
          "name": "key",
          "type": "tuple",
          "internalType": "struct PoolKey",
          "components": [
            {
              "name": "currency0",
              "type": "address",
              "internalType": "Currency"
            },
            {
              "name": "currency1",
              "type": "address",
              "internalType": "Currency"
            },
            {
              "name": "fee",
              "type": "uint24",
              "internalType": "uint24"
            },
            {
              "name": "tickSpacing",
              "type": "int24",
              "internalType": "int24"
            },
            {
              "name": "hooks",
              "type": "address",
              "internalType": "contract IHooks"
            }
          ]
        },
        {
          "name": "amount0",
          "type": "uint256",
          "internalType": "uint256"
        },
        {
          "name": "amount1",